id,texto,ad_hominem,ladeira_escorregadia,gen_apressada,falso_dilema,apelo_emocao,espantalho,falacias_esperadas,resposta_esperada
1,"Esse cara mentiu. Deixe eu falar pra vocês, esse cara mentiu sobre Ben Carson quando ele tirou os votos do Ben Carson em Iowa. E ele continua. Esse cara vai falar qualquer coisa. Cara nojento. Agora eu sei porque ele não tem patrocínios de nenhum dos seus colegas.",1,0,0,0,0,0,"Ad Hominem","Ataque pessoal que ignora o argumento."
2,"Pessoa A: Acho que precisamos discutir formas de reduzir o número de armas em circulação no Brasil. Pessoa B: Então você quer desarmar completamente a população e deixar os cidadãos indefesos contra criminosos?",0,0,0,0,0,1,"Espantalho","Distorce o argumento original."
3,"Se você ama de verdade o Brasil e se importa com o futuro dos seus filhos, precisa protestar contra essa PEC que tenta blindar os parlamentares. Ficar calado agora é trair a nação e deixar que destruam o país.",0,0,0,0,1,0,"Apelo à Emoção","Apela ao patriotismo e culpa."
4,"Depois da brutal megaoperação no Alemão-Penha onde dezenas de jovens morreram, fica claro que se não agirmos agora para proteger nossas comunidades e nossos filhos, estamos aceitando que mais vidas inocentes serão ceifadas. Você quer isso?",0,0,0,0,1,0,"Apelo à Emoção","Apelo ao medo e tragédia."
5,"Fui pra França no Natal, minha experiência lá com os franceses foi horrível. Até fui roubada quando visitei o museu do Louvre. Quando for pra Europa, saiba que a França é linda, mas os franceses são arrogantes e ladrões.",0,0,1,0,0,0,"Generalização Apressada","Generaliza a partir de poucos casos."
6,"Ou você apoia a reforma agraria, ou está contra o progresso e contra os direitos dos trabalhadores.",0,0,0,1,0,0,"Falso Dilema","Apresenta apenas duas opções extremas."
7,"Os ambientalistas vivem dizendo que querem proibir até as vacas de soltarem metano, como se o problema do clima fosse o gado. Eles exageram tudo e querem controlar até o que a gente come.",0,0,0,0,0,1,"Espantalho","Distorce a posição dos ambientalistas."
8,"Se começarmos a reduzir a jornada de trabalho e acabar com o regime 6x1, logo as empresas não vão conseguir se manter, o desemprego vai aumentar e a economia vai desabar",0,1,0,0,0,0,"Declive Escorregadio","Prediz desastre inevitável."
9,"As pessoas que criticam o uso de remédios naturais só querem vender mais remédios caros e não se preocupam com a saúde de verdade.",1,0,0,0,0,0,"Ad Hominem","Ataca motivação em vez de argumentar."
10,"Quem não votou no Lula nas últimas eleições é alguém que não apoia a classe trabalhadora. Não dá pra ficar em cima do muro quando o assunto é o povo — ou você está com os trabalhadores, ou está contra eles.",0,0,0,1,0,0,"Falso Dilema","Reduz a discussão a duas opções."
11,"Se aceitarmos que os esportes se tornem mais inclusivos para pessoas transgênero, logo todas as campeãs de competições femininas serão trans e as mulheres cisgênero não terão mais chance alguma de vencer",0,1,0,0,0,0,"Declive Escorregadio","Afirma que um passo leva ao extremo."
12,"Quem defende que o governo deve investir mais em ciência está apenas querendo gastar dinheiro público sem retorno real.",0,0,1,0,0,0,"Generalização Apressada","Generaliza motivação dos defensores."
13,"Esse deputado vive mentindo pra imprensa e só quer aparecer. Ele diz que defende ‘maior transparência’, mas no fundo quer censurar tudo e calar quem pensa diferente. Pessoas assim não merecem ser levadas a sério.",1,0,0,0,0,1,"Ad Hominem e Espantalho","Ataque pessoal e distorção."
14,"Ou você apoia a 'limpa' que foi feita no morro do Alemão ou está do lado dos criminosos que destroem famílias. Pense nas mães que perderam seus filhos! Quem se opõe a essa medida claramente não tem compaixão pelo sofrimento das reais vítimas.",0,0,0,1,1,0,"Falso Dilema e Apelo à Emoção","Falsa dicotomia e apelo emocional."
15,"Meu vizinho tomou a vacina e passou mal por semanas. Essas vacinas são perigosas! Se continuarem obrigando todo mundo a tomar, logo o governo vai controlar até o que colocamos no corpo.",0,1,1,0,0,0,"Declive Escorregadio e Generalização Apressada","Generalização + cadeia catastrófica."
16,"Pessoa A: Acho que deveríamos revisar o conteúdo das escolas para incluir mais discussões sobre desigualdade. Pessoa B: Então você quer doutrinar as crianças e encher as salas de aula de ideologia? Pense nas famílias que só querem proteger seus filhos dessas ideias perigosas!",0,0,0,0,1,1,"Apelo à Emoção e Espantalho","Distorção + apelo emocional."
17,"Quem critica a privatização é um preguiçoso que nunca produziu nada. Ou você apoia o livre mercado e o progresso, ou quer ver o país afundar na miséria.",1,0,0,1,0,0,"Ad Hominem e Falso Dilema","Ataque + falsa dicotomia."
18,"Se aceitarmos que protestos bloqueiem ruas, logo o país inteiro vai virar um caos sem ordem nem segurança. Pense nas famílias que não conseguem chegar ao hospital por causa desses manifestantes irresponsáveis.",0,1,0,0,1,0,"Declive Escorregadio e Apelo à Emoção","Cenário extremo + apelo emocional."
19,"Os acontecimentos no Nepal e agora no México mostram de forma clara que ou o Brasil regula as redes sociais ou seremos alvo de um golpe digital, tal qual está ocorrendo pelo mundo todo.",0,0,1,1,0,0,"Generalização Apressada e Falso Dilema","Generaliza e reduz a duas opções."
20,"Pessoa A: Precisamos reduzir o consumo de carne para ajudar o planeta. Pessoa B: Então você quer acabar com os churrascos, fechar fazendas e destruir a economia rural? Se isso acontecer, o país vai quebrar.",0,1,0,0,0,1,"Declive Escorregadio e Espantalho","Distorção + previsão de desastre."
21,"Você não deveria levar a sério o economista João; ele nunca conseguiu nem administrar a própria vida, imagine a economia do país.",1,0,0,0,0,0,"Ad Hominem","Ataque pessoal sem discutir ideias."
22,"Pessoa A: Acho que precisamos discutir limites para aluguel abusivo. Pessoa B: Ah, claro, você quer que ninguém mais possa alugar imóveis e destruir o mercado!",0,0,0,0,0,1,"Espantalho","Distorção extrema do argumento."
23,"Se você realmente ama sua família, vai apoiar este projeto de segurança. Não apoiar é abandonar quem você ama.",0,0,0,0,1,0,"Apelo à Emoção","Manipula culpa e medo."
24,"Conheci dois argentinos mal-humorados na viagem. Os argentinos são todos assim, insuportáveis.",0,0,1,0,0,0,"Generalização Apressada","Conclusão baseada em poucos casos."
25,"Ou você é a favor do uso de câmeras policiais ou está do lado dos que defendem a criminalidade.",0,0,0,1,0,0,"Falso Dilema","Ignora posições intermediárias."
26,"Se começarmos a limitar a publicidade infantil, logo as crianças vão parar de ter qualquer criatividade e o país vai virar um caos educativo.",0,1,0,0,0,0,"Declive Escorregadio","Prevê desastre sem base."
27,"Você não pode ouvir esse historiador. Ele é um fracassado que nem conseguiu publicar livros de verdade.",1,0,0,0,0,0,"Ad Hominem","Ataque pessoal direto."
28,"Pessoa A: acho que deveríamos criar incentivos para transporte público. Pessoa B: Então você quer proibir os carros e destruir a liberdade das pessoas.",0,0,0,0,0,1,"Espantalho","Distorção exagerada."
29,"Se você não apoiar este candidato agora, então não se importa com o futuro dos seus filhos.",0,0,0,0,1,0,"Apelo à Emoção","Apelo emocional forte."
30,"Eu vi um entregador mal educado ontem. Esses entregadores são todos sem educação.",0,0,1,0,0,0,"Generalização Apressada","Generalização de 1 caso."
31,"Ou aumentamos o policiamento imediatamente ou vamos viver em total anarquia.",0,0,0,1,0,0,"Falso Dilema","Redução binária extrema."
32,"Se permitirmos novamente festas de rua, logo não haverá mais controle algum e a cidade inteira vai virar uma zona.",0,1,0,0,0,0,"Declive Escorregadio","Supõe caos inevitável."
33,"Pessoa A: acho que precisamos revisar impostos para empresas. Pessoa B: Então você quer destruir o empreendedorismo! E quem apoia isso claramente não tem compaixão pelos trabalhadores que dependem desses empregos.",0,0,0,0,1,1,"Apelo à Emoção e Espantalho","Distorção + apelo emocional."
34,"Esse jornalista vive espalhando lorotas. Ele diz que defende a liberdade de imprensa, mas na verdade quer controlar tudo e manipular o povo.",1,0,0,0,0,1,"Ad Hominem e Espantalho","Ataque pessoal + distorção."
35,"Ou você apoia esse projeto de segurança agora, ou está do lado dos criminosos que aterrorizam famílias inteiras. Pense nas mães desesperadas!",0,0,0,1,1,0,"Falso Dilema e Apelo à Emoção","Falsa dicotomia + apelo emocional."
36,"Quem critica esse plano econômico é um derrotado que nunca realizou nada. Ou você está com o progresso ou é parte do atraso que destrói o país.",1,0,0,1,0,0,"Ad Hominem e Falso Dilema","Ataque + polarização extrema."
37,"Se começarmos a liberar protestos em rodovias, logo ninguém conseguirá chegar ao trabalho. Eu vi *um* protesto que parou uma ambulância, então *todos* os protestos vão acabar matando gente.",0,1,1,0,0,0,"Declive Escorregadio e Generalização Apressada","Projeção extrema + generalização."
38,"Os críticos das redes sociais só querem censura. Ou aceitamos regular tudo agora ou seremos vítimas do mesmo caos que já acontece lá fora.",0,0,1,1,0,0,"Generalização Apressada e Falso Dilema","Generaliza + dicotomia falsa."
39,"Pessoa A: precisamos reduzir plástico descartável. Pessoa B: Você só diz isso porque é um ativista desocupado que nunca produziu nada! Se fizermos isso, o país vai quebrar de vez.",1,1,0,0,0,0,"Ad Hominem e Declive Escorregadio","Ataque + previsão de desastre."
40,"Meu vizinho trocou o fogão a gás por um elétrico e a conta explodiou. Se todo mundo fizer isso, o sistema elétrico do país vai colapsar e ficaremos no escuro.",0,1,1,0,0,0,"Declive Escorregadio e Generalização Apressada","Generaliza + cenário extremo."